<?xml version="1.0" encoding="UTF-8"?>
<!--
Click nbfs://nbhost/SystemFileSystem/Templates/Licenses/license-default.txt to change this license
Click nbfs://nbhost/SystemFileSystem/Templates/XML/XMLDocument.xml to edit this template
-->
<company xmlns:xsi='http://www.w3.org/2001/XMLSchema-instance' xsi:noNamespaceSchemaLocation='schema05.xsd'>
    <employee>
        <firstName>Juan</firstName>
        <LastName>Sanchez</LastName>
        <ContactNo>123456789</ContactNo>
        <Email>juansanchez@company.com</Email>
        <Address>
            <City>Bangalore</City>
            <State>Karnataka</State>
            <Zip>560212</Zip>
        </Address>
    </employee>
</company>

